{
  "schema_name": "gunnchos.campus_measurement_mapping",
  "schema_version": "1.0.0",
  "run_id": "closed-loop-v2-germany-map",
  "site_id": "germany",
  "campus_slug": "germany",
  "phase": "FULL",
  "campus_requirement_id": "GERMANY.FULL.INDUSTRY40_TWIN_LAB",
  "space_id": "industry40_twin_lab",
  "coarse_grid_cell": "Z0",
  "measurement_point_id": "germany-mp-01",
  "campus_model_version": "CAMPUS_V2_PLANNING",
  "infrastructure_version": "NETWORK_DESIGN_V1",
  "evidence_ref": "closed-loop-v2-germany-opt",
  "batch_sha256": "c4eff717176b46b26e26ad995df93cd500fcba7ab2ef3d89f8f4eedde3fadbf3",
  "contains_person_path": false,
  "exact_minor_location": false,
  "producer": {
    "repository": "edge-io-measurement-node",
    "commit": "4f3095e349f522d6db9901b99101f3fe5dff9f6c"
  }
}
