{
  "schema_name": "gunnchos.campus_measurement_mapping",
  "schema_version": "1.0.0",
  "run_id": "closed-loop-v2-gaza-map",
  "site_id": "gaza",
  "campus_slug": "gaza",
  "phase": "FULL_RECOVERY_EDUCATION_HUB",
  "campus_requirement_id": "GAZA.RECOVERY.OFFLINE_LEARNING_STUDIO",
  "space_id": "offline_learning_studio",
  "coarse_grid_cell": "Z0",
  "measurement_point_id": "gaza-mp-01",
  "campus_model_version": "CAMPUS_V2_PLANNING",
  "infrastructure_version": "NETWORK_DESIGN_V1",
  "evidence_ref": "closed-loop-v2-gaza-opt",
  "batch_sha256": "e22aa6174f0b1611fa98e718acec80ac2e78b48de60c7df46dbd12e58a1b2067",
  "contains_person_path": false,
  "exact_minor_location": false,
  "producer": {
    "repository": "edge-io-measurement-node",
    "commit": "4f3095e349f522d6db9901b99101f3fe5dff9f6c"
  }
}
